[
  {
    "copyright": "T. Rector",
    "date": "2017-07-08",
    "explanation": "Similar in size to large, bright spiral galaxies in our neighborhood, IC 342 is a mere 10 million light-years distant in the long-necked, northern constellation Camelopardalis. A sprawling island universe, IC 342 would otherwise be a prominent galaxy in our night sky, but it is hidden from clear view and only glimpsed through the veil of stars, gas and dust clouds along the plane of our own Milky Way galaxy.",
    "hdurl": "https://apod.nasa.gov/apod/image/1707/ic342_rector2048.jpg",
    "media_type": "image",
    "service_version": "v1",
    "title": "Hidden Galaxy IC 342",
    "url": "https://apod.nasa.gov/apod/image/1707/ic342_rector1024s.jpg"
  },
  {
    "date": "2017-07-09",
    "explanation": "Can you find your favorite country or city?  Surprisingly, on this world-wide nightscape, city lights make this task quite possible.  Human-made lights highlight particularly developed or populated areas of the Earth's surface, including the seaboards of Europe, the eastern United States, and Japan.",
    "hdurl": "https://apod.nasa.gov/apod/image/1707/EarthAtNight_SuomiNPP_3600.jpg",
    "media_type": "image",
    "service_version": "v1",
    "title": "Earth at Night",
    "url": "https://apod.nasa.gov/apod/image/1707/EarthAtNight_SuomiNPP_1080.jpg"
  },
  {
    "date": "2017-07-10",
    "explanation": "What's happening around the center of this spiral galaxy? Seen in total, NGC 1512 appears to be a barred spiral galaxy -- a type of spiral that has a straight bar of stars across its center.",
    "hdurl": "https://apod.nasa.gov/apod/image/1707/NGC1512_Schmidt_1342.jpg",
    "media_type": "image",
    "service_version": "v1",
    "title": "Spiral Galaxy NGC 1512: The Nuclear Ring",
    "url": "https://apod.nasa.gov/apod/image/1707/NGC1512_Schmidt_960.jpg"
  }
]
