[
  {
    "copyright": "Panther Observatory",
    "date": "2006-04-15",
    "explanation": "In this stunning cosmic vista, galaxy M81 is on the left surrounded by blue spiral arms.  On the right marked by massive gas and dust clouds, is M82.  These two mammoth galaxies have been locked in gravitational combat for the past billion years.   The gravity from each galaxy dramatically affects the other during each hundred million-year pass.  Last go-round, M82's gravity likely raised density waves rippling around M81, resulting in the richness of M81's spiral arms.  But M81 left M82 with violent star forming regions and colliding gas clouds so energetic the galaxy glows in X-rays.  In a few billion years only one galaxy will remain.",
    "hdurl": "https://apod.nasa.gov/apod/image/0604/M81_M82_schedler_c80.jpg",
    "media_type": "image",
    "service_version": "v1",
    "title": "Galaxy Wars: M81 versus M82",
    "url": "https://apod.nasa.gov/apod/image/0604/M81_M82_schedler_c25.jpg"
  },
  {
    "date": "2013-07-22",
    "explanation": "You are here.  Everyone you've ever known is here. Every human who has ever lived -- is here. Pictured above is the Earth-Moon system as captured by the Cassini mission orbiting Saturn in the outer Solar System. Earth is the brighter and bluer of the two spots near the center, while the Moon is visible to its lower right.",
    "hdurl": "https://apod.nasa.gov/apod/image/1307/earthmoon2_cassini_946.jpg",
    "media_type": "image",
    "service_version": "v1",
    "title": "Earth and Moon from Saturn",
    "url": "https://apod.nasa.gov/apod/image/1307/earthmoon2_cassini_960.jpg"
  },
  {
    "copyright": "Joe Orman",
    "date": "2000-04-06",
    "explanation": "Rising before the Sun on February 2nd, astrophotographer Joe Orman anticipated this apparition of the bright morning star Venus near a lovely crescent Moon above a neighbor's house in suburban Phoenix, Arizona, USA.",
    "hdurl": "https://apod.nasa.gov/apod/image/0004/vm_orman_big.jpg",
    "media_type": "image",
    "service_version": "v1",
    "title": "Venus, Moon, and Neighbors",
    "url": "https://apod.nasa.gov/apod/image/0004/vm_orman.jpg"
  },
  {
    "date": "2014-07-12",
    "explanation": "A new star, likely the brightest supernova in recorded human history, lit up planet Earth's sky in the year 1006 AD. The expanding debris cloud from the stellar explosion, found in the southerly constellation of Lupus, still puts on a cosmic light show across the electromagnetic spectrum.",
    "hdurl": "https://apod.nasa.gov/apod/image/1407/sn1006c.jpg",
    "media_type": "image",
    "service_version": "v1",
    "title": "SN 1006 Supernova Remnant",
    "url": "https://apod.nasa.gov/apod/image/1407/sn1006c_c800.jpg"
  },
  {
    "date": "1997-01-21",
    "explanation": "In Jules Verne's science fiction classic A Journey to the Center of the Earth, Professor Hardwigg and his fellow explorers encounter many strange and exciting wonders. What wonders lie at the center of our Galaxy?",
    "hdurl": "https://apod.nasa.gov/apod/image/9701/galcen_msx_big.gif",
    "media_type": "image",
    "service_version": "v1",
    "title": "Journey to the Center of the Galaxy",
    "url": "https://apod.nasa.gov/apod/image/9701/galcen_msx.jpg"
  }
]
